{
  "bounding_box": {
    "max": [
      1,
      1,
      0
    ],
    "min": [
      0,
      0,
      0
    ]
  },
  "dimensions": {
    "depth": 1,
    "height": 0,
    "width": 1
  },
  "engine_versions": {
    "cam": "0.0.0",
    "nest": "0.0.0",
    "occt": "0.0.0",
    "schemas": "0.0.0",
    "wood": "0.0.0"
  },
  "inputs_hash": "03f0a5415dc7d5374922cdd858e9be81ee45f214f40968df49d194243d64cf37",
  "label": "reference_panel",
  "revision_id": "97fd46038317a780454e2e7dcb5ce0255739c36b",
  "seed": 0,
  "source_format": "step",
  "surface_area": 1,
  "triangle_count": 2,
  "vertex_count": 4
}
